{
  "schema_version": "1.0.0",
  "id": "ar-tb-2023-matching-sentence-endings",
  "module": "academic",
  "set_name": "ielts-academic-reading-sample-tasks-2023-taskbank",
  "source": {
    "source_type": "official_sample",
    "source_id": "ielts-academic-reading-sample-tasks-2023.pdf",
    "source_url": "https://ielts.org/cdn/Sample-tests/ielts-academic-reading-sample-tasks-2023.pdf",
    "licence": {
      "name": "IELTS Partners",
      "redistributable": false,
      "notes": "官方免费样题。task bank 中的短文可能含第三方版权声明（如 © The Atlantic），整段原文不得再分发。"
    },
    "retrieved_at": "2026-08-29T18:05:32.041388+08:00",
    "verified_on": "2026-08-29",
    "page_refs": [
      19,
      20,
      21,
      22,
      23
    ],
    "derivation": "从分题型 task bank PDF 自动解析"
  },
  "passage": {
    "id": "ar-tb-2023-matching-sentence-endings-text",
    "title": "Matching Sentence Endings",
    "paragraphs": [
      {
        "label": "A",
        "text": "Endings 1500s.] Science in 16th-century London The Jewel House, a new book by historical researcher and author Deborah Harkness Deborah Harkness devotes her elegant and erudite new book, The Jewel House, to the scientific community in 16th-century London. She (rightly) argues that it is  thanks to the imaginative collective efforts of the urban scientists that London became the melting pot in which a new mathematical and experimental culture crystallized. Harkness is known for her ingenuity as  a researcher and her historical empathy. In The Jewel House, Harkness turns her skills on the city of London as a whole with surprising and fascinating results. She began her research by asking herself a new question: not what caused scientific revolution but what the names science and scientist meant in 16th - century London. Then she collected a vast range of sources, from  printed books to scientific instruments and notebooks, and recorded, in a relational database, information on the men and women who produced them. Every chapter of The Jewel House charts the activities of a particular community. Harkness leads us through the streets of London, showing us, neighborhood by neighborhood, where the major forms of natural knowledge found homes. For example, apothecaries settled in Lime Street, in what is now the City, where they created a dense network of shops and gardens. Clockmakers, both native craftsmen and many from overseas, clustered in several parishes near St Paul’s Cathedral. The once wealthy merchant, Clement Draper, even  managed to transform the King’s Bench prison in Southwark, where he served time as a debtor, into a center of research and discussion. By the end of the book Harkness has mapped London’s scientific communities with astonishing precision. Moreover,  when Harkness reconstructs these groups, she provides not traditional, static accounts of their theories, but dynamic analyses of their practices as these developed over time. In many cases, she makes  clear, the alchemists of Elizabethan London already understood that knowledge of nature had to rest not on authority but on familiarity through practice. In one crucial respect, Harkness argues, many of the 16th -century London scientists differed from the later ones of the 17th century. They saw themselves less as individuals out to gain fame, than as members of larger textual communities bent on exchanging and compiling information. The passages in which Harkness analyzes the 16th- century practices of note -taking and communication are among the most novel and informative in this fine book. She shows that they adopted the textual information processing methods of humanist scholarship to radically new ends. In this book, Harkness has charted the local and cosmopolitan worlds of science in Elizabethan London with a learning, precision and intelligence that compel admiration. Moreover, she has crafted a complex and effective new analytical mechanism which may transform the practices of historians of early modern science. Complete each sentence with the correct ending, A-F, below. Write the correct letter, A-F, in boxes 1-3 on your answer sheet. A she has the greatest knowledge of Elizabethan London."
      }
    ],
    "word_count": 501,
    "has_diagram": false
  },
  "question_groups": [
    {
      "id": "matching-sentence-endings-q1-3",
      "type": "matching_sentence_endings",
      "instruction": "Endings 1500s.] Science in 16th-century London The Jewel House, a new book by historical researcher and author Deborah Harkness Deborah Harkness devotes her elegant and erudite new book, The Jewel House, to the scientific community in 16th-century London. She (rightly) argues that it is  thanks to the imaginative collective efforts of the urban scientists that London became the melting pot in which a new mathematical and experimental culture crystallized. Harkness is known for her ingenuity as  a researcher and her historical empathy. In The Jewel House, Harkness turns her skills on the city o",
      "question_range": {
        "from": 1,
        "to": 3
      },
      "ordered": true,
      "options": [
        {
          "key": "B",
          "text": "she started by seeking to understand how basic terms were used in the past."
        },
        {
          "key": "C",
          "text": "they worked as individuals rather than as a group."
        },
        {
          "key": "D",
          "text": "she examined how their methods evolved and changed."
        },
        {
          "key": "E",
          "text": "Clement Draper was the best scientist of his time."
        },
        {
          "key": "F",
          "text": "they used old ways of analysing written information for new purposes."
        }
      ],
      "questions": [
        {
          "number": 1,
          "stem": "Harkness’s research method was different to that of other writers because",
          "answer": "B",
          "evidence": [
            {
              "quote": "The once wealthy merchant, Clement Draper, even managed to transform the King’s Bench prison in Southwark, where he served time as a debtor, into a center of research and discussion. By the end of the book Harkness has mapped London’s scientific communities with astonishing precision.",
              "start": 1499,
              "end": 1784,
              "paragraph_label": "A",
              "is_core": true
            }
          ]
        },
        {
          "number": 2,
          "stem": "Harkness’s reconstruction of the 16th-century London scientific groups was new because",
          "answer": "D",
          "evidence": [
            {
              "quote": "Endings 1500s.] Science in 16th-century London The Jewel House, a new book by historical researcher and author Deborah Harkness Deborah Harkness devotes her elegant and erudite new book, The Jewel House, to the scientific community in 16th-century London.",
              "start": 0,
              "end": 255,
              "paragraph_label": "A",
              "is_core": true
            }
          ]
        },
        {
          "number": 3,
          "stem": "Harkness shows that the 16th-century London scientists were innovative because",
          "answer": "F",
          "evidence": [
            {
              "quote": "Endings 1500s.] Science in 16th-century London The Jewel House, a new book by historical researcher and author Deborah Harkness Deborah Harkness devotes her elegant and erudite new book, The Jewel House, to the scientific community in 16th-century London. She (rightly) argues that it is thanks to th",
              "start": 0,
              "end": 458,
              "paragraph_label": "A",
              "is_core": true
            }
          ]
        }
      ]
    }
  ],
  "meta": {
    "quality_status": "parsed_unverified",
    "qc": {
      "evidence_missing": false,
      "paraphrase_missing": true,
      "question_count": 3,
      "answers_matched": 3,
      "evidence_needs_review": []
    },
    "build_version": "parse_reading_taskbank.py@1.0",
    "content_hash": "05cfc2a9a96c9b23",
    "created_at": "2026-08-29T18:05:32.041388+08:00",
    "not_official": true
  }
}