{
  "schema_version": "1.0.0",
  "id": "gt-tb-2023-short-answer-questions",
  "module": "general_training",
  "set_name": "ielts-general-training-reading-sample-tasks-2023-taskbank",
  "source": {
    "source_type": "official_sample",
    "source_id": "ielts-general-reading-sample-tasks-2023.pdf",
    "source_url": "https://ielts.org/cdn/Sample-tests/ielts-general-reading-sample-tasks-2023.pdf",
    "licence": {
      "name": "IELTS Partners",
      "redistributable": false,
      "notes": "官方免费样题。task bank 中的短文可能含第三方版权声明（如 © The Atlantic），整段原文不得再分发。"
    },
    "retrieved_at": "2026-08-29T18:05:32.393955+08:00",
    "verified_on": "2026-08-29",
    "page_refs": [
      26,
      27
    ],
    "derivation": "从分题型 task bank PDF 自动解析"
  },
  "passage": {
    "id": "gt-tb-2023-short-answer-questions-text",
    "title": "Short- answer Questions",
    "paragraphs": [
      {
        "label": "A",
        "text": "answer Questions Answer the questions below. Choose NO MORE THAN THREE WORDS AND/OR A NUMBER from the text for each answer. Write your answers in boxes 4-8 on your answer sheet. should you contact? contaminated their product? IMPORTANT NOTICE: PRODUCT RETURN Fancy Foods wishes to inform the public that pieces of metal have been found in some jars of Fancy Foods Chicken Curry (Spicy). The batches of the jars involved have numbers from J6617 to J6624. The batch number is printed on the bottom of each jar. If you have any jars with these batch numbers, please return them (preferably unopened) to the supermarket where  you purchased them. You can also return them to the factory (Fancy Foods Retailers, Blacktown). Fancy Foods will pay $10 for each jar returned unopened and $5 for each  jar already opened. No payment will be made for empty jars, which do not need to be returned. However, the Retailing Manager will be interested to hear from people who have consumed chicken curry from any of the above batch numbers. In particular, it will be helpful if they can give information about the place of purchase of the product. Jars of Fancy Foods Chicken Curry (Coconut) and Fancy Foods Chicken Curry (Mango) have not been affected and do not need to be returned. REWARD Fancy Foods will pay a reward of $10,000 to $50,000 for information which leads to the conviction of any person found guilty of placing metal pieces in its products. If you have such information, please contact the Customer Relations Manager, Fancy Foods Retailers, Blacktown."
      }
    ],
    "word_count": 259,
    "has_diagram": false
  },
  "question_groups": [
    {
      "id": "short-answer-questions-q4-8",
      "type": "short_answer",
      "instruction": "answer Questions Questions 4 – 8 Answer the questions below. Choose NO MORE THAN THREE WORDS AND/OR A NUMBER from the text for each answer. Write your answers in boxes 4-8 on your answer sheet. 4 What has been found in some Fancy Foods products? 5 Where can you find the batch number on the jars? 6 How much will you receive for an opened jar of contaminated Chicken Curry? 7 If you have eaten Chicken Curry from a jar with one of the batch numbers listed, whom should you contact? 8 What is the maximum reward Fancy Foods is offering for information about who contaminated their product? IMPORTANT N",
      "word_limit": "NO MORE THAN THREE WORDS",
      "question_range": {
        "from": 4,
        "to": 8
      },
      "ordered": true,
      "questions": [
        {
          "number": 4,
          "stem": "What has been found in some Fancy Foods products?",
          "answer": "pieces",
          "evidence": [
            {
              "quote": "REWARD Fancy Foods will pay a reward of $10,000 to $50,000 for information which leads to the conviction of any person found guilty of placing metal pieces in its products.",
              "start": 1267,
              "end": 1439,
              "paragraph_label": "A",
              "is_core": true
            }
          ]
        },
        {
          "number": 5,
          "stem": "Where can you find the batch number on the jars?",
          "answer": "(on)",
          "evidence": [
            {
              "quote": "The batch number is printed on the bottom of each jar. If you have any jars with these batch numbers, please return them (preferably unopened) to the supermarket where you purchased them.",
              "start": 454,
              "end": 641,
              "paragraph_label": "A",
              "is_core": true
            }
          ]
        },
        {
          "number": 6,
          "stem": "How much will you receive for an opened jar of contaminated Chicken Curry?",
          "answer": "$5",
          "evidence": [
            {
              "quote": "contaminated their product? IMPORTANT NOTICE: PRODUCT RETURN Fancy Foods wishes to inform the public that pieces of metal have been found in some jars of Fancy Foods Chicken Curry (Spicy).",
              "start": 198,
              "end": 386,
              "paragraph_label": "A",
              "is_core": true
            }
          ]
        },
        {
          "number": 7,
          "stem": "If you have eaten Chicken Curry from a jar with one of the batch numbers listed, whom",
          "answer": "(the)",
          "evidence": [
            {
              "quote": "However, the Retailing Manager will be interested to hear from people who have consumed chicken curry from any of the above batch numbers.",
              "start": 884,
              "end": 1022,
              "paragraph_label": "A",
              "is_core": true
            }
          ]
        },
        {
          "number": 8,
          "stem": "What is the maximum reward Fancy Foods is offering for information about who",
          "answer": "$50,000",
          "evidence": [
            {
              "quote": "REWARD Fancy Foods will pay a reward of $10,000 to $50,000 for information which leads to the conviction of any person found guilty of placing metal pieces in its products.",
              "start": 1267,
              "end": 1439,
              "paragraph_label": "A",
              "is_core": true
            }
          ]
        }
      ]
    }
  ],
  "meta": {
    "quality_status": "parsed_unverified",
    "qc": {
      "evidence_missing": false,
      "paraphrase_missing": true,
      "question_count": 5,
      "answers_matched": 5,
      "evidence_needs_review": []
    },
    "build_version": "parse_reading_taskbank.py@1.0",
    "content_hash": "23a689369a94fc35",
    "created_at": "2026-08-29T18:05:32.393955+08:00",
    "not_official": true
  }
}